{
  "track_id": "e2e_smoke_tests_20260409",
  "type": "infrastructure",
  "status": "pending",
  "phase": 0,
  "priority": "High",
  "created_at": "2026-04-09T01:00:00Z",
  "updated_at": "2026-04-09T01:00:00Z",
  "description": "E2E Smoke Tests & Integration Test Infrastructure — Real Dataverse environment tests, CI workflow, secure credentials",
  "dependencies": ["pr_lifecycle_20260409"],
  "api_sources": ["Dataverse Web API (real ServiceClient)", "GitHub Actions Secrets", "MSTest"]
}
