{
  "track_id": "dataverse_gaps_20260409",
  "type": "feature",
  "status": "pending",
  "phase": 3,
  "priority": "High",
  "created_at": "2026-04-09T01:00:00Z",
  "updated_at": "2026-04-09T01:00:00Z",
  "description": "Dataverse Platform Gaps — Custom APIs, Catalog, Elastic Tables, Virtual Tables, Connection Refs",
  "dependencies": [],
  "api_sources": ["Dataverse Web API (customapi, catalog, externaldatasource, connectionreference)"]
}
