{
  "track_id": "ms_forms_20260409",
  "type": "feature",
  "status": "pending",
  "phase": 13,
  "priority": "Medium",
  "created_at": "2026-04-09T01:00:00Z",
  "updated_at": "2026-04-09T01:00:00Z",
  "description": "Microsoft Forms CLI — List forms, export responses, response count, compliance reporting",
  "dependencies": [],
  "api_sources": ["Forms internal API (forms.office.com)", "MSAL (Microsoft.Identity.Client)"]
}
