{
  "track_id": "env_lifecycle_20260409",
  "type": "feature",
  "status": "pending",
  "phase": 9,
  "priority": "High",
  "created_at": "2026-04-09T01:00:00Z",
  "updated_at": "2026-04-09T01:00:00Z",
  "description": "Environment Lifecycle Management — Create, clone, backup, restore, capacity, reset",
  "dependencies": ["alm_center_20260409"],
  "api_sources": ["Power Platform Admin API (BAP)", "Dataverse Management API"]
}
