{
  "track_id": "forms_authoring_20260428",
  "type": "feature",
  "status": "in_progress",
  "phase": 14,
  "priority": "High",
  "created_at": "2026-04-28T00:00:00Z",
  "updated_at": "2026-04-28T07:42:00Z",
  "description": "Microsoft Forms authoring CLI for source-controlled create, update, delete, publish, and question manipulation manifests",
  "dependencies": [
    "ms_forms_20260409",
    "forms_advanced_20260421",
    "documentation_site_20260421",
    "cli_ux_20260421"
  ],
  "api_sources": [
    "Microsoft Forms API",
    "Microsoft Graph",
    "Customer Voice API"
  ]
}
