{
  "track_id": "ai_builder_connectors_20260409",
  "type": "feature",
  "status": "pending",
  "phase": 12,
  "priority": "Medium",
  "created_at": "2026-04-09T01:00:00Z",
  "updated_at": "2026-04-09T01:00:00Z",
  "description": "AI Builder & Custom Connectors — Model management, form processor, connector import/export/test/validate",
  "dependencies": [],
  "api_sources": ["Dataverse Web API (aimodel, connector)", "AI Builder API", "HTTP"]
}
