{
  "track_id": "pr_lifecycle_20260409",
  "type": "infrastructure",
  "status": "pending",
  "phase": 0,
  "priority": "Critical",
  "created_at": "2026-04-09T01:00:00Z",
  "updated_at": "2026-04-09T01:00:00Z",
  "description": "PR Lifecycle Automation & CI/CD Improvements — Automated review, PR tracking, test coverage, static analysis, mutation testing",
  "dependencies": [],
  "api_sources": ["GitHub REST API (Octokit.NET)", "GitHub Actions", "coverlet", "CodeQL", "Stryker.NET"]
}
